{
  "repository_type": "global_impact_analysis_repository",
  "repository_version": "1.7.0",
  "workspace_id": "gic-workspace-bdc75d8b68333af2",
  "generated_at": "2026-07-17T22:11:10.956468+00:00",
  "benchmarks": [
    {
      "benchmark_id": "gic-benchmark-c4e83da3c63f2033f5f4",
      "workspace_id": "gic-workspace-bdc75d8b68333af2",
      "indicator_id": "gic-indicator-2e7a8f93231487ce",
      "indicator_definition_id": null,
      "name": "Reference benchmark",
      "benchmark_type": "external",
      "value": 20.0,
      "unit_id": "gic-unit-usd",
      "period_start": null,
      "period_end": null,
      "period_label": "2026 Q2",
      "geography": "",
      "population": "",
      "source_id": null,
      "method_definition_id": null,
      "quality_status": "not_assessed",
      "lifecycle_status": "draft",
      "revision": 1,
      "created_at": "2026-07-17T22:11:10.955396+00:00",
      "updated_at": "2026-07-17T22:11:10.955403+00:00",
      "metadata": {}
    }
  ],
  "comparison_sets": [],
  "scenarios": [
    {
      "scenario_id": "gic-scenario-79b2bbab5dc338848f16",
      "workspace_id": "gic-workspace-bdc75d8b68333af2",
      "initiative_id": "gic-initiative-09a657f60923ed45",
      "indicator_id": "gic-indicator-2e7a8f93231487ce",
      "indicator_definition_id": null,
      "name": "Linear planning case",
      "description": "",
      "scenario_type": "projection",
      "model_type": "linear",
      "unit_id": "gic-unit-usd",
      "start_period": "",
      "end_period": "",
      "periods": 3,
      "base_value": 18.0,
      "source_id": null,
      "method_definition_id": null,
      "target_model_id": null,
      "lifecycle_status": "draft",
      "revision": 1,
      "created_at": "2026-07-17T22:11:10.955810+00:00",
      "updated_at": "2026-07-17T22:11:10.955814+00:00",
      "parameters": {
        "period_change": 4.0
      },
      "assumptions": [],
      "limitations": [],
      "metadata": {}
    }
  ],
  "uncertainty_models": [
    {
      "uncertainty_model_id": "gic-uncertainty-model-8161c85c5162324d87f4",
      "workspace_id": "gic-workspace-bdc75d8b68333af2",
      "name": "Planning range",
      "uncertainty_type": "relative",
      "confidence_level": 0.95,
      "absolute_margin": null,
      "relative_margin_percent": 10.0,
      "lower_bound": null,
      "upper_bound": null,
      "distribution": "bounded",
      "source_id": null,
      "method_definition_id": null,
      "lifecycle_status": "draft",
      "revision": 1,
      "created_at": "2026-07-17T22:11:10.955587+00:00",
      "updated_at": "2026-07-17T22:11:10.955591+00:00",
      "assumptions": [],
      "limitations": [],
      "metadata": {}
    }
  ],
  "analysis_runs": [
    {
      "analysis_run_id": "gic-analysis-run-2e1c0a0c45617474cbfc",
      "workspace_id": "gic-workspace-bdc75d8b68333af2",
      "initiative_id": "gic-initiative-09a657f60923ed45",
      "analysis_type": "scenario_evaluation",
      "subject_id": "gic-scenario-79b2bbab5dc338848f16",
      "input_hash": "37c44b90d39469dcbca4171bd747a650b787032d10cf94d456e4125318375fde",
      "result_hash": "8f17ce5790b4c4fe7a5c902473688373227786a6121dd879ab08577cce94c7b3",
      "created_by": "system",
      "created_at": "2026-07-17T22:11:10.956065+00:00",
      "result": {
        "analysis_type": "scenario_evaluation",
        "analysis_version": "1.7.0",
        "assumptions": [],
        "base_observation_id": null,
        "base_value": 18.0,
        "boundary": "Scenario output is a conditional planning calculation, not a forecast or causal estimate.",
        "indicator_id": "gic-indicator-2e7a8f93231487ce",
        "initiative_id": "gic-initiative-09a657f60923ed45",
        "integrity": {
          "point_count": 4,
          "valid": true,
          "warnings": []
        },
        "limitations": [],
        "model_type": "linear",
        "parameters": {
          "period_change": 4.0
        },
        "points": [
          {
            "period_index": 0,
            "uncertainty": {
              "confidence_level": 0.95,
              "distribution": "bounded",
              "lower": 16.2,
              "margin": 1.8,
              "uncertainty_model_id": "gic-uncertainty-model-8161c85c5162324d87f4",
              "uncertainty_type": "relative",
              "upper": 19.8,
              "value": 18.0
            },
            "unit_id": "gic-unit-usd",
            "value": 18.0
          },
          {
            "period_index": 1,
            "uncertainty": {
              "confidence_level": 0.95,
              "distribution": "bounded",
              "lower": 19.8,
              "margin": 2.2,
              "uncertainty_model_id": "gic-uncertainty-model-8161c85c5162324d87f4",
              "uncertainty_type": "relative",
              "upper": 24.2,
              "value": 22.0
            },
            "unit_id": "gic-unit-usd",
            "value": 22.0
          },
          {
            "period_index": 2,
            "uncertainty": {
              "confidence_level": 0.95,
              "distribution": "bounded",
              "lower": 23.4,
              "margin": 2.6,
              "uncertainty_model_id": "gic-uncertainty-model-8161c85c5162324d87f4",
              "uncertainty_type": "relative",
              "upper": 28.6,
              "value": 26.0
            },
            "unit_id": "gic-unit-usd",
            "value": 26.0
          },
          {
            "period_index": 3,
            "uncertainty": {
              "confidence_level": 0.95,
              "distribution": "bounded",
              "lower": 27.0,
              "margin": 3.0,
              "uncertainty_model_id": "gic-uncertainty-model-8161c85c5162324d87f4",
              "uncertainty_type": "relative",
              "upper": 33.0,
              "value": 30.0
            },
            "unit_id": "gic-unit-usd",
            "value": 30.0
          }
        ],
        "scenario_id": "gic-scenario-79b2bbab5dc338848f16",
        "uncertainty_model_id": "gic-uncertainty-model-8161c85c5162324d87f4",
        "unit_id": "gic-unit-usd",
        "workspace_id": "gic-workspace-bdc75d8b68333af2"
      },
      "metadata": {}
    }
  ],
  "sensitivity_runs": [],
  "integrity": {
    "valid": true,
    "benchmark_count": 1,
    "comparison_set_count": 0,
    "comparison_member_count": 0,
    "scenario_count": 1,
    "uncertainty_model_count": 1,
    "analysis_run_count": 1,
    "sensitivity_run_count": 0,
    "orphan_comparison_member_ids": [],
    "orphan_sensitivity_run_ids": []
  },
  "boundary": "Analysis records improve transparency but do not create assurance, certification, causality, or verified forecasts."
}
